{
  "$schema": "https://json-schema.org/draft/2020-12/schema",
  "$id": "project-context.schema.json",
  "title": "GroundSpec Project Context",
  "type": "object",
  "additionalProperties": false,
  "required": ["version", "project", "language", "framework", "sourceDirectory", "constraints"],
  "properties": {
    "version": { "type": "integer", "const": 1 },
    "project": { "type": "string", "minLength": 1 },
    "language": { "type": "string", "minLength": 1 },
    "framework": { "type": "string", "minLength": 1 },
    "sourceDirectory": { "type": "string", "minLength": 1 },
    "constraints": { "type": "array", "items": { "type": "string", "minLength": 1 } }
  }
}
